title, link, author, created_time
Bayesian Approach to Regression Analysis with Python, https://www.analyticsvidhya.com/blog/2022/04/bayesian-approach-to-regression-analysis-with-python/, Sunil Kumar Dash, April 26 2022
Getting Started with Big Data & Hadoop, https://www.analyticsvidhya.com/blog/2022/04/getting-started-with-big-data-hadoop/, Harsh Kulkarni, April 26 2022
Binary Classification on Skin Cancer Dataset Using DL, https://www.analyticsvidhya.com/blog/2022/04/binary-classification-on-skin-cancer-dataset-using-dl/, TK Kaushik Jegannathan, April 26 2022
Getting Started with databases like MySQL, https://www.analyticsvidhya.com/blog/2022/04/getting-started-with-databases-like-mysql/, sathishrouthu, April 26 2022
AWS Redshift: Cloud Data Warehouse Service, https://www.analyticsvidhya.com/blog/2022/04/aws-redshift-cloud-data-warehouse-service/, Prateek Majumder, April 25 2022
Guide to Audio Classification Using Deep Learning, https://www.analyticsvidhya.com/blog/2022/04/guide-to-audio-classification-using-deep-learning/, shakhadri313, April 25 2022
Exploring Octoparse Web Scraping Tool for Data Preparations, https://www.analyticsvidhya.com/blog/2022/04/exploring-octoparse-web-scraping-tool-for-data-preparations/, shanthababu, April 24 2022
Docker Tutorial for Beginners Part-I, https://www.analyticsvidhya.com/blog/2022/04/docker-tutorial-for-beginners-part-i/, Abhishek Jaiswal, April 24 2022
Spark Data Streaming with MongoDB, https://www.analyticsvidhya.com/blog/2022/04/spark-data-streaming-with-mongodb/, Abhishek Jaiswal, April 23 2022
Introduction to SQL for Data Engineering, https://www.analyticsvidhya.com/blog/2022/04/introduction-to-sql-for-data-engineering/, Aman Preet Gulati, April 23 2022
